{
  "topic": "Как собрать документы для проверки стажа",
  "audience": "пенсионер или взрослый ребёнок, помогающий родителю",
  "problem": "документы лежат хаотично, непонятно с чего начать",
  "emotionBefore": "перегрузка и растерянность",
  "desiredState": "порядок, ясность, спокойный контроль",
  "coreMessage": "сначала соберите документы в одну понятную систему папок",
  "metaphor": "четыре аккуратные папки вместо хаотичной стопки бумаг",
  "action": "руки взрослого человека раскладывают нейтральные листы по папкам",
  "subject": "светлый стол, четыре папки, чек-лист с пустыми чекбоксами, ручка",
  "visualStyle": "realistic editorial top-down still life photography",
  "mood": "calm, respectful, organized",
  "brandPalette": "soft white background with restrained navy blue and green accents",
  "composition": "top-down composition, objects in lower and central areas",
  "textSafeArea": "upper right third",
  "platform": "MAX",
  "aspectRatio": "1:1",
  "prohibitions": [
    "personal documents",
    "banknotes",
    "official logos",
    "readable text on papers"
  ]
}
